Lot_No,Lot_Title,Estimate_Price,Deal_Price,Deal_Date,Category_L0,Category_L1,No,Price
lot66,SAPPHIRE AND DIAMOND RING,"USD 30,000-USD 50,000","USD 50,000",8 Dec 2020,CORUNDUM,BLUE SAPPHIRE,1,50000
lot67,ART DECO COLORED SAPPHIRE AND DIAMOND RING,"USD 12,000 - USD 18,000","USD 15,000",8 Dec 2020,CORUNDUM,PINK SAPPHIRE,2,15000
lot71,"SAPPHIRE AND DIAMOND RING, BULGARI","USD 15,000 - USD 20,000","USD 50,000",8 Dec 2020,CORUNDUM,BLUE SAPPHIRE,3,50000
lot441,diamond,,"USD 40,000",8 Dec 2020,DIAMOND,RED DIAMOND,4,400000
lot328,sapphire,,"USD 80,000",8 Dec 2020,CORUNDUM,BLUE SAPPHIRE,5,80000